{
  "schemaVersion": 4,
  "metadata": {
    "name": "Plataforma 2D",
    "referenceResolution": {
      "width": 1280,
      "height": 720
    },
    "spatial": {
      "positionUnit": "world-pixel",
      "cellOrigin": "top-left",
      "yAxis": "down",
      "entityAnchor": "center"
    }
  },
  "skeletons": [],
  "meshes": [],
  "camera": {
    "frequency": 2,
    "damping": 1,
    "response": 2,
    "anticipationSeconds": 0.15
  },
  "lights": [
    {
      "lightId": "key-light",
      "type": "point",
      "position": [
        136,
        80
      ],
      "height": 1,
      "color": [
        1,
        1,
        1
      ],
      "intensity": 1.2,
      "radius": 240
    }
  ],
  "entityDefs": [
    {
      "entityDefId": "player",
      "archetypeId": "player",
      "tags": [
        "player"
      ],
      "editor": {
        "color": "#3aa0ff"
      },
      "fields": [
        {
          "name": "speed",
          "type": "float",
          "default": 90
        },
        {
          "name": "jumpVelocity",
          "type": "float",
          "default": 320
        }
      ]
    }
  ],
  "entities": [
    {
      "entityId": "player-1",
      "entityDefId": "player",
      "position": [
        40,
        120
      ],
      "fields": {
        "speed": 90,
        "jumpVelocity": 320
      }
    }
  ],
  "levels": [
    {
      "levelId": "level-1",
      "width": 16,
      "height": 9,
      "tileSize": 16,
      "seed": 1,
      "intGrid": [
        1,
        0,
        0,
        0,
        0,
        0,
        0,
        0,
        0,
        0,
        0,
        0,
        0,
        0,
        0,
        1,
        1,
        0,
        0,
        0,
        0,
        0,
        0,
        0,
        0,
        0,
        0,
        0,
        0,
        0,
        0,
        1,
        1,
        0,
        0,
        0,
        0,
        0,
        0,
        0,
        0,
        0,
        0,
        0,
        0,
        0,
        0,
        1,
        1,
        0,
        0,
        0,
        0,
        0,
        0,
        0,
        0,
        0,
        0,
        0,
        0,
        0,
        0,
        1,
        1,
        0,
        0,
        0,
        0,
        0,
        0,
        0,
        0,
        0,
        0,
        0,
        0,
        0,
        0,
        1,
        1,
        0,
        0,
        0,
        0,
        0,
        0,
        0,
        0,
        0,
        0,
        0,
        0,
        0,
        0,
        1,
        1,
        0,
        0,
        0,
        0,
        0,
        0,
        0,
        0,
        0,
        0,
        0,
        0,
        0,
        0,
        1,
        1,
        0,
        0,
        0,
        0,
        0,
        0,
        0,
        0,
        0,
        0,
        0,
        0,
        0,
        0,
        1,
        1,
        1,
        1,
        1,
        1,
        1,
        1,
        1,
        1,
        1,
        1,
        1,
        1,
        1,
        1,
        1
      ],
      "rules": [
        {
          "patternSize": 1,
          "pattern": [
            1
          ],
          "tileIds": [
            1
          ]
        }
      ],
      "palette": [
        {
          "value": 1,
          "name": "Chão",
          "color": "#7a5230"
        },
        {
          "value": 2,
          "name": "Parede",
          "color": "#5a6a7a"
        },
        {
          "value": 3,
          "name": "Perigo",
          "color": "#b8433a"
        }
      ]
    }
  ],
  "placements": [
    {
      "levelId": "level-1",
      "x": 0,
      "y": 0
    }
  ],
  "projectId": "fixture-platformer-v3"
}
